"GCV2","YMR189W","mitochondria","79.11","25.153","","","","","","","","","mitochondria","91.11","1.15","0","44.12","mitochondria","91.58","1.15","0","21.86","mitochondria","137.3","1.73","1","","mitochondria","mitochondria","117.765","1.48841","1","22.8303","P subunit of the mitochondrial glycine decarboxylase complex, required for the catabolism of glycine to 5,10-methylene-THF; expression is regulated by levels of 5,10-methylene-THF in the cytoplasm"
"GCV3","YAL044C","mitochondria","128.43","44.9306","mitochondria","228.592","mitochondria","127.685","cytosol,mitochondria","423.311","#N/A","84.8764","mitochondria","150.44","1.17","0","71.19","mitochondria","167.32","1.3","0","48.05","mitochondria","469.5","3.65","1","","mitochondria","mitochondria","202.228","1.57444","1","58.1128","H subunit of the mitochondrial glycine decarboxylase complex, required for the catabolism of glycine to 5,10-methylene-THF; also required for all protein lipoylation; expression is regulated by levels of 5,10-methylene-THF"
"GEP3","YOR205C","mitochondria","20.39","4.65404","mitochondria","49.8422","mitochondria","0","missing","0","#N/A","36.8911","mitochondria","","","0","","mitochondria","","","0","","mitochondria","","","","","mitochondria","mitochondria","","","0","","Protein of unknown function; null mutant is defective in respiration and interacts synthetically with prohibitin (phb1); the authentic, non-tagged protein is detected in purified mitochondria in high-throughput studies"
"GEP5","YLR091W","mitochondria","19.2","3.80073","cytosol,punctate,nucleus","41.5909","nucleus","","missing","27.2951","#N/A","","mitochondria","19.5","1.01","0","6.74","mitochondria","17.53","0.91","0","3.37","mitochondria","19","0.98","0","","mitochondria","mitochondria","18.768","0.977062","0","2.95859","Protein of unknown function, required for mitochondrial genome maintenance; detected in highly purified mitochondria in high-throughput studies; null mutant has decreased levels of cardiolipin and phosphatidylethanolamine"
"GEP7","YGL057C","mitochondria","16.51","4.30817","cytosol,mitochondria","42.2133","punctate,mitochondria","20.0136","below threshold","16.8583","#N/A","0","mitochondria","19.69","1.19","0","5.49","mitochondria","18.15","1.09","0","3.66","mitochondria","27.49","1.66","0","","mitochondria","mitochondria","17.1986","1.04113","0","2.30263","Protein of unknown function; null mutant exhibits a respiratory growth defect and synthetic interactions with prohibitin (phb1) and gem1; authentic, non-tagged protein is detected in highly purified mitochondria in high-throughput studies"
"GLO4","YOR040W","mitochondria","18.6","4.63527","mitochondria","105.297","mitochondria","19.2395","mitochondria","6.79132","#N/A","23.7479","mitochondria","20.16","1.08","0","8.61","mitochondria","19.95","1.07","0","4.69","mitochondria","21.06","1.13","0","","mitochondria","mitochondria","19.4657","1.04635","0","4.03055","Mitochondrial glyoxalase II, catalyzes the hydrolysis of S-D-lactoylglutathione into glutathione and D-lactate"
"GLR1","YPL091W","cytosol:mitochondria","61.05","15.0061","cytosol","347.685","punctate","47.3034","punctate","356.08","cytosol,punctate","80.6787","cytosol.mitochondria","72.28","1.18","0","23.2","cytosol.mitochondria","71.25","1.16","0","22.16","cytosol,mitochondria","59.83","0.97","0","","cytosol:mitochondria","cytosol:mitochondria","55.6903","0.912111","0","7.94558","Cytosolic and mitochondrial glutathione oxidoreductase, converts oxidized glutathione to reduced glutathione; mitochondrial but not cytosolic form has a role in resistance to hyperoxia"
"GRX5","YPL059W","mitochondria","58.04","14.6596","mitochondria","132.036","missing","43.6734","mitochondria","","#N/A","62.9396","mitochondria","79.12","1.36","1","34.44","mitochondria","49.79","0.85","0","12.24","mitochondria","95.12","1.63","1","","mitochondria","mitochondria","40.1668","0.691885","0","6.16855","Hydroperoxide and superoxide-radical responsive glutathione-dependent oxidoreductase; mitochondrial matrix protein involved in the synthesis/assembly of iron-sulfur centers; monothiol glutaredoxin subfamily member along with Grx3p and Grx4p"
"GUF1","YLR289W","mitochondria","21.63","4.65876","","","","","","","","","mitochondria","22.64","1.04","0","7.76","mitochondria","23.57","1.08","0","5.29","mitochondria","22.11","1.02","0","","mitochondria","mitochondria","23.8273","1.10137","0","3.58491","Mitochondrial matrix GTPase that associates with mitochondrial ribosomes; important for translation under temperature and nutrient stress; may have a role in translational fidelity; similar to bacterial LepA elongation factor"
"GUT2","YIL155C","mitochondria","18.71","4.02347","mitochondria","69.7688","mitochondria","32.2524","ambiguous","70.6069","#N/A","29.2287","mitochondria","20.31","1.08","0","9.39","mitochondria","23.77","1.27","0","3.95","mitochondria","17.34","0.92","0","","mitochondria","mitochondria","21.9436","1.17253","0","3.73473","Mitochondrial glycerol-3-phosphate dehydrogenase; expression is repressed by both glucose and cAMP and derepressed by non-fermentable carbon sources in a Snf1p, Rsf1p, Hap2/3/4/5 complex dependent manner"
"HEM15","YOR176W","mitochondria","66.97","24.6857","mitochondria","190.559","mitochondria","34.4488","cell periphery,punctate","206.264","#N/A","41.3758","mitochondria","91.58","1.36","1","40.08","mitochondria","75.91","1.13","0","17.33","mitochondria","94.65","1.41","1","","mitochondria","mitochondria","61.161","0.913154","0","13.0274","Ferrochelatase, a mitochondrial inner membrane protein, catalyzes the insertion of ferrous iron into protoporphyrin IX, the eighth and final step in the heme biosynthetic pathway"
"HER2","YMR293C","mitochondria","19.52","4.77825","cytosol","51.3891","punctate","20.3253","below threshold","25.0782","#N/A","","mitochondria","23.89","1.22","0","9.2","mitochondria","18.4","0.94","0","4.39","mitochondria","21.53","1.1","0","","mitochondria","mitochondria","19.2944","0.987884","0","3.62251","Subunit of the trimeric GatFAB AmidoTransferase(AdT) complex; involved in the formation of Q-tRNAQ; required for remodeling of ER caused by Hmg2p overexpression; similar to bacterial GatA glutamyl-tRNA amidotransferase"
"HFA1","YMR207C","mitochondria","18.55","4.68826","cytosol","43.6676","cytosol","18.3669","below threshold","42.9466","#N/A","0","technical problem","","","0","","mitochondria","21.92","1.18","0","4.28","mitochondria","17.39","0.93","0","","mitochondria","mitochondria","20.9735","1.1301","0","3.57981","Mitochondrial acetyl-coenzyme A carboxylase, catalyzes the production of malonyl-CoA in mitochondrial fatty acid biosynthesis"
"HSP78","YDR258C","mitochondria","76.79","34.8009","mitochondria","138.751","mitochondria","21.1246","mitochondria","164.792","#N/A","42.3698","mitochondria","128.25","1.67","1","80.66","mitochondria","119.25","1.55","1","33.81","mitochondria","284.25","3.7","1","","mitochondria","mitochondria","72.811","0.948048","0","22.1606","Oligomeric mitochondrial matrix chaperone that cooperates with Ssc1p in mitochondrial thermotolerance after heat shock; able to prevent the aggregation of misfolded proteins as well as resolubilize protein aggregates"
"ICL2","YPR006C","mitochondria","22.58","5.10949","mitochondria","116.772","mitochondria","17.7627","below threshold","128.573","#N/A","42.1979","mitochondria","24.36","1.07","0","9.65","mitochondria","24.66","1.09","0","5.2","mitochondria","17.94","0.79","-1","","mitochondria","mitochondria","23.6618","1.04738","0","3.87623","2-methylisocitrate lyase of the mitochondrial matrix, functions in the methylcitrate cycle to catalyze the conversion of 2-methylisocitrate to succinate and pyruvate; ICL2 transcription is repressed by glucose and induced by ethanol"
"ICP55","YER078C","mitochondria","26.58","7.48639","mitochondria","132.557","mitochondria","21.048","mitochondria","20.7634","#N/A","29.4572","mitochondria","33.42","1.25","0","12.37","mitochondria","21.85","0.82","0","5.31","mitochondria","20.18","0.75","-1","","mitochondria","mitochondria","32.6376","1.22746","0","4.33632","Mitochondrial aminopeptidase; cleaves the N termini of at least 38 imported proteins after cleavage by the mitochondrial processing peptidase (MPP), thereby increasing their stability; member of the aminopeptidase P family"
"ICS3","YJL077C","mitochondria","18.1","5.2175","below threshold","15.9315","below threshold","19.4579","below threshold","6.01972","#N/A","22.6405","mitochondria","21.71","1.19","0","6.07","mitochondria","16.76","0.92","0","3.9","mitochondria","21.46","1.18","0","","mitochondria","mitochondria","15.6415","0.863654","0","1.69698","Protein of unknown function"
"IDH1","YNL037C","mitochondria","161.26","53.352","","","","","","","","","mitochondria","153.89","0.95","0","52.86","mitochondria","182.59","1.13","0","34.99","mitochondria","328.26","2.03","1","","mitochondria","mitochondria","163.515","1.01396","0","26.3194","Subunit of mitochondrial NAD(+)-dependent isocitrate dehydrogenase, which catalyzes the oxidation of isocitrate to alpha-ketoglutarate in the TCA cycle"
"IDH2","YOR136W","mitochondria","227.41","68.8931","mitochondria","177.737","missing","123.172","cell periphery,punctate,vacuole","0","#N/A","43.3336","mitochondria","233.3","1.02","0","106.22","mitochondria","276.1","1.21","0","71.31","punctate, mitochondria","","","","","mitochondria","mitochondria","248.894","1.09445","0","37.0717","Subunit of mitochondrial NAD(+)-dependent isocitrate dehydrogenase, which catalyzes the oxidation of isocitrate to alpha-ketoglutarate in the TCA cycle; phosphorylated"
"IDP1","YDL066W","mitochondria","194.6","59.0244","mitochondria","275.722","mitochondria","102.858","mitochondria","109.554","#N/A","","mitochondria","217.8","1.11","0","117.9","mitochondria","222.9","1.14","0","38.75","mitochondria","117.41","0.6","0","","mitochondria","mitochondria","210.822","1.08332","0","67.284","Mitochondrial NADP-specific isocitrate dehydrogenase, catalyzes the oxidation of isocitrate to alpha-ketoglutarate; not required for mitochondrial respiration and may function to divert alpha-ketoglutarate to biosynthetic processes"
"ILV3","YJR016C","mitochondria","338.65","108.041","mitochondria","168.7","missing","","missing","","#N/A","0","mitochondria","307.88","0.9","0","102.8","mitochondria","368.92","1.08","0","61.14","mitochondria","262.23","0.77","0","","mitochondria","mitochondria","393.722","1.16258","0","82.7102","Dihydroxyacid dehydratase, catalyzes third step in the common pathway leading to biosynthesis of branched-chain amino acids"
"IMG1","YCR046C","mitochondria","44.82","10.5482","mitochondria","92.6431","mitochondria","0","missing","27.6744","#N/A","0","mitochondria","47.68","1.06","0","13.74","mitochondria","40.16","0.89","0","7.44","mitochondria","64.69","1.44","1","","mitochondria","mitochondria","54.7772","1.22196","0","13.4221","Mitochondrial ribosomal protein of the large subunit, required for respiration and for maintenance of the mitochondrial genome"
"IMG2","YCR071C","mitochondria","18.22","3.66861","mitochondria","77.6265","mitochondria","0","missing","6.73938","#N/A","","mitochondria","20.08","1.1","0","6.32","mitochondria","16.24","0.89","0","3","mitochondria","18.09","0.99","0","","mitochondria","mitochondria","16.5996","0.910862","0","2.17261","Mitochondrial ribosomal protein of the large subunit"
"INH1","YDL181W","mitochondria","54.29","28.2149","mitochondria","209.129","mitochondria","75.288","cytosol","360.087","#N/A","71.8825","mitochondria","66.97","1.23","0","30.89","mitochondria","52.16","0.96","0","12.95","mitochondria","111.8","2.05","1","","mitochondria","mitochondria","34.4511","0.634508","-1","9.74989","Protein that inhibits ATP hydrolysis by the F1F0-ATP synthase; inhibitory function is enhanced by stabilizing proteins Stf1p and Stf2p; has similarity to Stf1p; has a calmodulin-binding motif and binds calmodulin in vitro"
"ISA1","YLL027W","mitochondria","56.46","13.001","mitochondria","67.6038","missing","0","missing","","#N/A","30.678","mitochondria","53.35","0.94","0","16.81","mitochondria","46.65","0.82","0","8.74","mitochondria","73.2","1.29","0","","mitochondria","mitochondria","51.8035","0.917475","0","7.01869","Mitochondrial matrix protein involved in biogenesis of the iron-sulfur (Fe/S) cluster of Fe/S proteins, isa1 deletion causes loss of mitochondrial DNA and respiratory deficiency; depletion reduces growth on nonfermentable carbon sources"
"ISA2","YPR067W","mitochondria","32.07","6.36267","mitochondria","94.0327","missing","22.3184","mitochondria","","#N/A","0","mitochondria","31.84","0.99","0","10.95","mitochondria","29.3","0.91","0","5.51","mitochondria","46.89","1.46","1","","mitochondria","mitochondria","33.2492","1.03633","0","7.99361","Protein required for maturation of mitochondrial and cytosolic Fe/S proteins, localizes to the mitochondrial intermembrane space, overexpression of ISA2 suppresses grx5 mutations"
"ISD11","YER048W-A","mitochondria","93.51","30.7958","","","","","","","","","mitochondria","124.49","1.33","0","42.21","mitochondria","118.59","1.26","0","20.68","mitochondria","120.86","1.29","0","","mitochondria","mitochondria","75.9166","0.811759","0","12.226","Protein required for mitochondrial iron-sulfur cluster biosynthesis"
"ISU1","YPL135W","mitochondria","341.95","108.01","mitochondria","70.3948","mitochondria","119.165","mitochondria","52.3673","#N/A","36.8167","mitochondria","324.43","0.94","0","157.49","mitochondria","390.13","1.14","0","89.11","mitochondria","384.14","1.12","0","","mitochondria","mitochondria","237.888","0.695662","-1","45.9369","Conserved protein of the mitochondrial matrix, performs a scaffolding function during assembly of iron-sulfur clusters, interacts physically and functionally with yeast frataxin (Yfh1p); isu1 isu2 double mutant is inviable"
"JAC1","YGL018C","mitochondria","29.4","6.3462","mitochondria","93.7984","missing","0","missing","","#N/A","","mitochondria","27.86","0.94","0","9.96","mitochondria","25.79","0.87","0","5.27","mitochondria","28.8","0.97","0","","mitochondria","mitochondria","30.0481","1.02166","0","4.71342","Specialized J-protein that functions with Hsp70 in Fe-S cluster biogenesis in mitochondria, involved in iron metabolism; contains a J domain typical to J-type chaperones; localizes to the mitochondrial matrix"
"KGD2","YDR148C","mitochondria","56.59","24.6577","mitochondria","172.899","mitochondria","34.2486","mitochondria","347.185","#N/A","89.3782","mitochondria","81.23","1.43","1","46.77","mitochondria","54.62","0.96","0","15.13","mitochondria","100.99","1.78","1","","mitochondria","mitochondria","75.7909","1.33888","1","25.3156","Dihydrolipoyl transsuccinylase, component of the mitochondrial alpha-ketoglutarate dehydrogenase complex, which catalyzes the oxidative decarboxylation of alpha-ketoglutarate to succinyl-CoA in the TCA cycle; phosphorylated"
"LAP3","YNL239W","cytosol, mitochondria","48.31","12.4598","cytosol","315.383","cytosol","30.2477","punctate","337.41","#N/A","0","cytosol, mitochondria","49.39","1.02","0","16.11","cytosol, mitochondria","50.09","1.03","0","16.2","nucleus","","","","","cytosol, mitochondria","cytosol, mitochondria","57.834","1.19701","0","21.9878","Cysteine aminopeptidase with homocysteine-thiolactonase activity; protects cells against homocysteine toxicity; has bleomycin hydrolase activity in vitro; transcription is regulated by galactose via Gal4p; orthologous to human BLMH"
"LAT1","YNL071W","mitochondria","55.04","16.3023","mitochondria","268.808","mitochondria","39.4566","ambiguous,punctate","418.097","#N/A","54.204","mitochondria","69.54","1.26","0","28.51","mitochondria","46.52","0.84","0","10.75","mitochondria","","","","","mitochondria","mitochondria","68.967","1.25285","0","18.0487","Dihydrolipoamide acetyltransferase component (E2) of pyruvate dehydrogenase complex, which catalyzes the oxidative decarboxylation of pyruvate to acetyl-CoA"
"LCL3","YGL085W","mitochondria","21.41","5.96939","punctate,vacuole,mitochondria","21.4252","below threshold","17.3594","mitochondria","6.49571","#N/A","0","mitochondria","21.35","0.99","0","8.86","mitochondria","19.5","0.91","0","3.69","mitochondria","17.52","0.81","-1","","mitochondria","mitochondria","25.8908","1.20863","0","5.15092","Putative protein of unknown function, has homology to Staphylococcus aureus nuclease; green fluorescent protein (GFP)-fusion protein localizes to mitochondria and is induced in response to the DNA-damaging agent MMS"
"LEU5","YHR002W","mitochondria","14.92","3.70976","mitochondria","29.8467","mitochondria","20.3624","mitochondria","31.1704","#N/A","0","mitochondria","16.9","1.13","0","5.7","mitochondria","14.51","0.97","0","2.88","mitochondria","22.43","1.5","0","","mitochondria","mitochondria","15.6787","1.05054","0","2.55988","Mitochondrial carrier protein involved in the accumulation of CoA in the mitochondrial matrix; homolog of human Graves disease protein; does not encode an isozyme of Leu4p, as first hypothesized"
"LEU9","YOR108W","mitochondria","69.97","23.1628","mitochondria","144.381","mitochondria","56.8069","cytosol,nucleus","236.604","#N/A","76.8493","mitochondria","47.08","0.67","0","15.1","punctate","","","0","","punctate","","","","","mitochondria","mitochondria","90.1155","1.28779","0","11.1097","Alpha-isopropylmalate synthase II (2-isopropylmalate synthase), catalyzes the first step in the leucine biosynthesis pathway; the minor isozyme, responsible for the residual alpha-IPMS activity detected in a leu4 null mutant"
"LIP2","YLR239C","mitochondria","17.74","5.05515","mitochondria","97.9159","mitochondria","24.6608","ambiguous,mitochondria","63.5978","#N/A","32.758","mitochondria","20.27","1.14","0","5.73","mitochondria","19.81","1.11","0","3.14","mitochondria","19.97","1.12","0","","mitochondria","mitochondria","19.7839","1.11463","0","2.88372","Lipoyl ligase, involved in the modification of mitochondrial enzymes by the attachment of lipoic acid groups"
"LIP5","YOR196C","mitochondria","48.98","14.1707","mitochondria","118.337","mitochondria","33.6311","nucleus,mitochondria","111.279","#N/A","46.0317","mitochondria","50.57","1.03","0","15.65","mitochondria","44.74","0.91","0","8.44","mitochondria","","","","","mitochondria","mitochondria","53.8912","1.1001","0","7.73179","Protein involved in biosynthesis of the coenzyme lipoic acid, has similarity to E. coli lipoic acid synthase"
"LPD1","YFL018C","mitochondria","161.92","68.2755","mitochondria","163.981","mitochondria","62.9032","cytosol,punctate","37.0111","#N/A","31.8161","mitochondria","225.82","1.39","0","136.3","mitochondria","127.36","0.78","0","35.84","mitochondria","158.58","0.97","0","","mitochondria","mitochondria","167.322","1.03335","0","46.2468","Dihydrolipoamide dehydrogenase, the lipoamide dehydrogenase component (E3) of the pyruvate dehydrogenase and 2-oxoglutarate dehydrogenase multi-enzyme complexes"
"LSC1","YOR142W","mitochondria","62.26","21.2533","mitochondria","126.595","missing","","missing","","#N/A","","mitochondria","94.11","1.51","1","44.32","mitochondria","60.3","0.96","0","12.68","mitochondria","86.71","1.39","1","","mitochondria","mitochondria","67.1851","1.07898","0","11.9473","Alpha subunit of succinyl-CoA ligase, which is a mitochondrial enzyme of the TCA cycle that catalyzes the nucleotide-dependent conversion of succinyl-CoA to succinate; phosphorylated"
"LSC2","YGR244C","mitochondria","92.22","26.8729","mitochondria","201.066","mitochondria","41.3324","cytosol,punctate,vacuole","133.416","#N/A","42.5808","mitochondria","152.9","1.65","1","62.04","mitochondria","89.65","0.97","0","18.71","mitochondria","122.19","1.32","0","","mitochondria","mitochondria","107.977","1.17063","0","21.5171","Beta subunit of succinyl-CoA ligase, which is a mitochondrial enzyme of the TCA cycle that catalyzes the nucleotide-dependent conversion of succinyl-CoA to succinate"
"LYS12","YIL094C","mitochondria","230.98","68.396","mitochondria","98.1762","missing","15.9498","below threshold","","#N/A","","mitochondria","310.57","1.34","0","105.63","mitochondria","151.16","0.65","0","43.18","mitochondria","311.97","1.35","0","","mitochondria","mitochondria","275.859","1.19428","0","69.6765","Homo-isocitrate dehydrogenase, an NAD-linked mitochondrial enzyme required for the fourth step in the biosynthesis of lysine, in which homo-isocitrate is oxidatively decarboxylated to alpha-ketoadipate"
"MAE1","YKL029C","mitochondria","73.08","22.1199","mitochondria","115.557","mitochondria","116.187","cytosol,punctate","119.38","#N/A","68.493","mitochondria","52.45","0.71","0","21.39","mitochondria","98.65","1.34","1","20.13","mitochondria","84.74","1.15","0","","mitochondria","mitochondria","83.0249","1.13587","0","17.4732","Mitochondrial malic enzyme, catalyzes the oxidative decarboxylation of malate to pyruvate, which is a key intermediate in sugar metabolism and a precursor for synthesis of several amino acids"
"MAK16","YAL025C","mitochondria","35.7","10.4573","punctate,nucleus","126.102","missing","18.0822","punctate,nucleolus","0","nucleus,nucleolus","41.8846","mitochondria","34.91","0.97","0","14.12","mitochondria","39.51","1.1","0","7.35","mitochondria","41.94","1.17","0","","mitochondria","mitochondria","","","0","","Essential nuclear protein, constituent of 66S pre-ribosomal particles; required for maturation of 25S and 5.8S rRNAs; required for maintenance of M1 satellite double-stranded RNA of the L-A virus"
"MAS2","YHR024C","mitochondria","61.44","17.5336","mitochondria","71.9546","missing","21.0345","below threshold","","#N/A","33.3511","mitochondria","75.91","1.23","0","27.79","mitochondria","61.64","1","0","7.91","mitochondria","46.65","0.75","0","","mitochondria","mitochondria","74.6913","1.21544","0","10.5842","Larger subunit of the mitochondrial processing protease (MPP), essential processing enzyme that cleaves the N-terminal targeting sequences from mitochondrially imported proteins"
"MCR1","YKL150W","mitochondria","23.22","7.56696","mitochondria","157.249","mitochondria","65.4847","ambiguous,mitochondria","291.358","#N/A","80.4224","mitochondria","36.66","1.57","1","17.39","mitochondria","25.69","1.1","0","5.57","mitochondria","41.34","1.77","1","","mitochondria","mitochondria","25.581","1.10116","0","4.16288","Mitochondrial NADH-cytochrome b5 reductase, involved in ergosterol biosynthesis"
"MCX1","YBR227C","mitochondria","34.21","8.19567","mitochondria","130.126","mitochondria","37.0573","cytosol,punctate","98.2162","#N/A","46.8541","mitochondria","41.1","1.2","0","14.75","mitochondria","32.27","0.94","0","5.43","mitochondria","35.17","1.02","0","","mitochondria","mitochondria","41.1091","1.20165","0","4.56915","Mitochondrial matrix protein; putative ATP-binding chaperone with non-proteolytic function; similar to bacterial ClpX proteins"
"MDH1","YKL085W","mitochondria","257.7","100.276","mitochondria","107.098","mitochondria","34.1161","cytosol,mitochondria","43.3417","#N/A","34.5756","mitochondria","362.02","1.4","0","176.97","mitochondria","241.92","0.93","0","48.34","mitochondria","317.78","1.23","0","","mitochondria","mitochondria","263.211","1.02133","0","77.3662","Mitochondrial malate dehydrogenase, catalyzes interconversion of malate and oxaloacetate; involved in the tricarboxylic acid (TCA) cycle; phosphorylated"
"MDJ1","YFL016C","mitochondria","60.8","23.542","mitochondria","74.6221","missing","","missing","","#N/A","45.5522","mitochondria","63.2","1.03","0","31.85","mitochondria","61.01","1","0","15.15","mitochondria","140.72","2.31","1","","mitochondria","mitochondria","46.3037","0.761436","0","6.39711","Co-chaperone that stimulates the ATPase activity of the HSP70 protein Ssc1p; involved in protein folding/refolding in the mitochodrial matrix; required for proteolysis of misfolded proteins; member of the HSP40 (DnaJ) family of chaperones"
"MDJ2","YNL328C","mitochondria","24.01","6.2584","below threshold","24.5177","cytosol","19.1763","below threshold","9.67708","below threshold","24.9734","mitochondria","21.83","0.9","0","7.37","mitochondria","18.81","0.78","-1","4.43","mitochondria","19.14","0.79","0","","mitochondria","mitochondria","18.7909","0.782385","0","3.20499","Constituent of the mitochondrial import motor associated with the presequence translocase; function overlaps with that of Pam18p; stimulates the ATPase activity of Ssc1p to drive mitochondrial import; contains a J domain"
"MDL2","YPL270W","mitochondria","28.98","8.7424","","","","","","","","","mitochondria","31.78","1.09","0","10.36","vacuole membrane","29.96","1.03","0","5.37","mitochondria","40.08","1.38","1","","mitochondria","mitochondria","23.953","0.82626","0","3.64414","Mitochondrial inner membrane half-type ATP-binding cassette (ABC) transporter, required for respiratory growth at high temperature; similar to human TAP1 and TAP2 implicated in bare lymphocyte syndrome and Wegener-like granulomatosis"
"MDM32","YOR147W","mitochondria","20.51","3.41852","mitochondria","31.5451","mitochondria","25.3299","mitochondria","5.24081","#N/A","24.3041","mitochondria","","","0","","mitochondria","","","0","","mitochondria","","","","","mitochondria","mitochondria","","","0","","Mitochondrial inner membrane protein with similarity to Mdm31p, required for normal mitochondrial morphology and inheritance; interacts genetically with MMM1, MDM10, MDM12, and MDM34"
"MEF2","YJL102W","mitochondria","29.44","7.38618","","","","","","","","","mitochondria","","","0","","mitochondria","","","0","","punctate","","","","","mitochondria","mitochondria","","","0","","Mitochondrial elongation factor involved in translational elongation"
