"MSW1","YDR268W","mitochondria","23.8","6.07163","below threshold","13.5253","missing","19.2009","below threshold","","#N/A","","mitochondria","29.39","1.23","0","9.53","mitochondria","26.48","1.11","0","4.5","mitochondria","43.98","1.84","1","","mitochondria","mitochondria","23.2632","0.977189","0","3.69882","Mitochondrial tryptophanyl-tRNA synthetase"
"MSY1","YPL097W","mitochondria","28.42","6.53904","mitochondria","42.5473","missing","23.1799","below threshold","","#N/A","44.1213","mitochondria","29.18","1.02","0","13.55","mitochondria","27.95","0.98","0","5.78","mitochondria","23.06","0.81","0","","mitochondria","mitochondria","32.8435","1.15525","0","5.86564","Mitochondrial tyrosyl-tRNA synthetase"
"MTC3","YGL226W","mitochondria","21.29","4.65928","mitochondria","55.6376","mitochondria","29.8","cytosol,punctate","97.9609","#N/A","32.0541","mitochondria","19.57","0.91","0","6.21","mitochondria","16.48","0.77","-1","2.79","mitochondria","22.46","1.05","0","","mitochondria","mitochondria","16.6512","0.782018","0","2.28452","Protein of unknown function; green fluorescent protein (GFP)-fusion protein localizes to the mitochondrion; mtc3 is synthetically sick with cdc13-1"
"MTF2","YDL044C","mitochondria","29.67","6.60102","mitochondria","76.956","mitochondria","104.768","mitochondria","84.5941","#N/A","0","mitochondria","28.61","0.96","0","10.68","mitochondria","30.66","1.03","0","4.12","mitochondria","29.26","0.98","0","","mitochondria","mitochondria","30.6708","1.03352","0","4.76832","Mitochondrial matrix protein that interacts with an N-terminal region of mitochondrial RNA polymerase (Rpo41p) and couples RNA processing and translation to transcription"
"MTM1","YGR257C","mitochondria","17.95","4.98356","below threshold","0","mitochondria","20.2232","punctate,mitochondria","43.3322","mitochondria","27.7151","mitochondria","19.72","1.09","0","6.62","mitochondria","17.79","0.99","0","3.46","mitochondria","15.86","0.88","0","","mitochondria","mitochondria","16.4395","0.9156","0","2.31937","Mitochondrial protein of the mitochondrial carrier family, involved in activating mitochondrial Sod2p probably by facilitating insertion of an essential manganese cofactor"
"MTQ1","YNL063W","mitochondria","19.69","3.89326","cytosol,punctate,nucleus","30.6932","ambiguous,vacuole","16.3395","below threshold","0","#N/A","0","mitochondria","13.59","0.68","0","6.83","mitochondria","16.31","0.82","0","2.45","mitochondria","16.77","0.85","0","","mitochondria","mitochondria","22.4482","1.13955","0","2.8203","S-adenosylmethionine-dependent methyltransferase; methylates translational release factor Mrf1p; similar to E.coli PrmC; is not an essential gene"
"NAM2","YLR382C","mitochondria","22.13","","mitochondria","41.4285","mitochondria","","missing","6.38653","#N/A","26.9934","mitochondria","19.68","0.88","0","","mitochondria","19.79","0.89","0","","mitochondria","19.66","0.88","0","","","","","","","","Mitochondrial leucyl-tRNA synthetase, also has a direct role in splicing of several mitochondrial group I introns; indirectly required for mitochondrial genome maintenance"
"NAM9","YNL137C","mitochondria","39.25","","mitochondria","65.5736","missing","","missing","","#N/A","","mitochondria","41.94","1.06","0","","mitochondria","31.8","0.81","0","","mitochondria","29.36","0.74","0","","","","","","","","Mitochondrial ribosomal component of the small subunit"
"NCA2","YPR155C","mitochondria","25.57","","mitochondria","37.0558","missing","20.2946","mitochondria","","#N/A","23.7728","mitochondria","27.74","1.08","0","","mitochondria","28.47","1.11","0","","mitochondria","28.61","1.11","0","","","","","","","","Protein involved in regulation of mitochondrial expression of subunits 6 (Atp6p) and 8 (Atp8p) of the Fo-F1 ATP synthase; functions with Nca3p"
"NDE1","YMR145C","mitochondria","82.23","","mitochondria","185.125","mitochondria","65.6268","mitochondria","12.0665","#N/A","27.1061","mitochondria","66.82","0.81","0","","mitochondria","81.26","0.98","0","","mitochondria","41.18","0.5","-1","","","","","","","","Mitochondrial external NADH dehydrogenase, a type II NAD(P)H:quinone oxidoreductase that catalyzes the oxidation of cytosolic NADH; Nde1p and Nde2p provide cytosolic NADH to the mitochondrial respiratory chain"
"NFS1","YCL017C","mitochondria","98.85","","mitochondria","151.632","missing","39.9972","mitochondria","","#N/A","","mitochondria","133.41","1.34","0","","mitochondria","79.44","0.8","0","","mitochondria","139.32","1.4","1","","","","","","","","Cysteine desulfurase involved in iron-sulfur cluster (Fe/S) biogenesis; required for the post-transcriptional thio-modification of mitochondrial and cytoplasmic tRNAs; essential protein located predominantly in mitochondria"
"NFU1","YKL040C","mitochondria","79.61","","mitochondria","122.798","mitochondria","45.2962","cytosol,mitochondria","119.39","#N/A","44.7551","mitochondria","87.04","1.09","0","","mitochondria","89.07","1.11","0","","mitochondria","70.18","0.88","0","","","","","","","","Protein involved in iron metabolism in mitochondria; similar to NifU, which is a protein required for the maturation of the Fe/S clusters of nitrogenase in nitrogen-fixing bacteria"
"NGL1","YOL042W","mitochondria","17.05","","punctate,mitochondria","88.382","mitochondria","22.2433","punctate","13.9304","#N/A","27.1014","mitochondria","","","","","mitochondria","19.84","1.16","0","","mitochondria","27.48","1.61","0","","","","","","","","Putative endonuclease, has a domain similar to a magnesium-dependent endonuclease motif in mRNA deadenylase Ccr4p; the authentic, non-tagged protein is detected in highly purified mitochondria in high-throughput studies"
"NIF3","YGL221C","mitochondria","36.36","","cytosol","234.36","cytosol","46.4746","cytosol","306.456","cytosol","70.9659","mitochondria","40.09","1.1","0","","mitochondria","35.98","0.98","0","","mitochondria","26.97","0.74","0","","","","","","","","Protein of unknown function, similar to Listeria monocytogenes major sigma factor (rpoD gene product); the authentic, non-tagged protein is detected in highly purified mitochondria in high-throughput studies"
"NIT3","YLR351C","mitochondria","41.15","","cytosol","207.594","cytosol","28.1564","cytosol","342.875","#N/A","","mitochondria","47.71","1.15","0","","mitochondria","42.22","1.02","0","","mitochondria","54.77","1.33","0","","","","","","","","Nit protein, one of two proteins in S. cerevisiae with similarity to the Nit domain of NitFhit from fly and worm and to the mouse and human Nit protein which interacts with the Fhit tumor suppressor; nitrilase superfamily member"
"NUC1","YJL208C","mitochondria","28.76","","cytosol","45.1182","cytosol","29.6131","cytosol","20.3406","#N/A","0","mitochondria","19.45","0.67","-1","","mitochondria","27.06","0.94","0","","mitochondria","19.82","0.68","-1","","","","","","","","Major mitochondrial nuclease, has RNAse and DNA endo- and exonucleolytic activities; has roles in mitochondrial recombination, apoptosis and maintenance of polyploidy"
"OAR1","YKL055C","mitochondria","20.09","","cytosol","46.0763","cell periphery,vacuole","17.0473","below threshold","70.8272","#N/A","0","mitochondria","32.97","1.64","0","","mitochondria","19.7","0.98","0","","mitochondria","21.66","1.07","0","","","","","","","","Mitochondrial 3-oxoacyl-[acyl-carrier-protein] reductase, may comprise a type II mitochondrial fatty acid synthase along with Mct1p"
"OMA1","YKR087C","mitochondria","18.45","","mitochondria","93.4096","mitochondria","25.7297","mitochondria","9.36176","#N/A","25.8327","mitochondria","17.48","0.94","0","","mitochondria","19.79","1.07","0","","mitochondria","18.66","1.01","0","","","","","","","","Metalloendopeptidase of the mitochondrial inner membrane, involved in turnover of membrane-embedded proteins; member of a family of predicted membrane-bound metallopeptidases in prokaryotes and higher eukaryotes"
"ORT1","YOR130C","mitochondria","18.85","","mitochondria","53.9475","mitochondria","31.9768","mitochondria","33.0078","#N/A","0","mitochondria","","","","","mitochondria","","","","","mitochondria","","","","","","","","","","","Ornithine transporter of the mitochondrial inner membrane, exports ornithine from mitochondria as part of arginine biosynthesis; human ortholog is associated with hyperammonaemia-hyperornithinaemia-homocitrullinuria (HHH) syndrome"
"OSM1","YJR051W","mitochondria","21.65","","mitochondria","64.819","mitochondria","35.1222","ER,punctate","105.348","#N/A","60.6574","mitochondria","21.78","1","0","","mitochondria","17.99","0.83","0","","mitochondria","22.18","1.02","0","","","","","","","","Fumarate reductase, catalyzes the reduction of fumarate to succinate, required for the reoxidation of intracellular NADH under anaerobic conditions; mutations cause osmotic sensitivity"
"PAD1","YDR538W","mitochondria","20.2","","mitochondria","128.84","mitochondria","20.1363","mitochondria","232.656","#N/A","44.9581","mitochondria","21.66","1.07","0","","mitochondria","16.57","0.82","0","","mitochondria","20.85","1.03","0","","","","","","","","Phenylacrylic acid decarboxylase, confers resistance to cinnamic acid, decarboxylates aromatic carboxylic acids to the corresponding vinyl derivatives; homolog of E. coli UbiX"
"PAM16","YJL104W","mitochondria","89.62","","mitochondria","72.4885","missing","","missing","","#N/A","0","mitochondria","87.72","0.97","0","","mitochondria","61.01","0.68","0","","mitochondria","61.52","0.68","0","","","","","","","","Constituent of the import motor (PAM complex) component of the Translocase of the Inner Mitochondrial membrane (TIM23 complex); forms a 1:1 subcomplex with Pam18p and inhibits its cochaperone activity; contains a J-like domain"
"PCP1","YGR101W","mitochondria","19.12","","mitochondria","101.751","mitochondria","41.0559","mitochondria","55.7833","#N/A","29.1386","mitochondria","19.52","1.02","0","","mitochondria","16.09","0.84","0","","mitochondria","17.25","0.9","0","","","","","","","","Mitochondrial serine protease required for the processing of various mitochondrial proteins and maintenance of mitochondrial DNA and morphology; belongs to the rhomboid-GlpG superfamily of intramembrane peptidases"
"PDH1","YPR002W","mitochondria","23.27","","cytosol","104.821","cell periphery,vacuole","22.5606","cytosol","0","#N/A","0","mitochondria","23.06","0.99","0","","mitochondria","21.75","0.93","0","","mitochondria","15.01","0.64","-1","","","","","","","","Mitochondrial protein that participates in respiration, induced by diauxic shift; homologous to E. coli PrpD, may take part in the conversion of 2-methylcitrate to 2-methylisocitrate"
"PET100","YDR079W","mitochondria","21.23","","mitochondria","94.875","mitochondria","17.8099","below threshold","191.585","#N/A","33.1406","mitochondria","23.47","1.1","0","","mitochondria","27.85","1.31","0","","mitochondria","23.95","1.12","0","","","","","","","","Chaperone that specifically facilitates the assembly of cytochrome c oxidase, integral to the mitochondrial inner membrane; interacts with a subcomplex of subunits VII, VIIa, and VIII (Cox7p, Cox9p, and Cox8p) but not with the holoenzyme"
"PET112","YBL080C","mitochondria","19.01","","mitochondria","60.9809","missing","0","missing","0","#N/A","28.4273","mitochondria","21.77","1.14","0","","mitochondria","18.75","0.98","0","","mitochondria","20.17","1.06","0","","","","","","","","Subunit of the trimeric GatFAB AmidoTransferase(AdT) complex; involved in the formation of Q-tRNAQ; mutation is functionally complemented by the bacterial GatB ortholog"
"PET123","YOR158W","mitochondria","54.83","","nucleus","55.8944","cell periphery,vacuole","20.4243","below threshold","","#N/A","0","mitochondria","60.52","1.1","0","","mitochondria","70","1.27","0","","mitochondria","61.64","1.12","0","","","","","","","","Mitochondrial ribosomal protein of the small subunit; PET123 exhibits genetic interactions with PET122, which encodes a COX3 mRNA-specific translational activator"
"PET20","YPL159C","mitochondria","16.43","","mitochondria","83.7066","mitochondria","21.4744","mitochondria","9.20608","#N/A","25.3727","mitochondria","18.86","1.14","0","","mitochondria","17.15","1.04","0","","mitochondria","17.01","1.03","0","","","","","","","","Mitochondrial protein, required for respiratory growth under some conditions and for stability of the mitochondrial genome"
"PET309","YLR067C","mitochondria","21.15","","mitochondria","29.9967","mitochondria","0","missing","26.7571","#N/A","26.5999","mitochondria","18.52","0.87","0","","mitochondria","17.11","0.8","-1","","mitochondria","18.91","0.89","0","","","","","","","","Specific translational activator for the COX1 mRNA, also influences stability of intron-containing COX1 primary transcripts; localizes to the mitochondrial inner membrane; contains seven pentatricopeptide repeats (PPRs)"
"PET494","YNR045W","mitochondria","16.79","","mitochondria","37.6298","missing","15.1603","below threshold","0","#N/A","24.2431","mitochondria","17.24","1.02","0","","mitochondria","17.49","1.04","0","","mitochondria","18.49","1.1","0","","","","","","","","Mitochondrial translational activator specific for the COX3 mRNA, acts together with Pet54p and Pet122p; located in the mitochondrial inner membrane"
"PET8","YNL003C","mitochondria","18.1","","mitochondria","45.6675","mitochondria","21.2656","punctate,mitochondria","44.1772","#N/A","0","mitochondria","21.71","1.19","0","","mitochondria","16.54","0.91","0","","mitochondria","18.84","1.04","0","","","","","","","","S-adenosylmethionine transporter of the mitochondrial inner membrane, member of the mitochondrial carrier family; required for biotin biosynthesis and respiratory growth"
"PHB1","YGR132C","mitochondria","36.05","","cytosol,punctate","62.9254","cytosol","24.8175","punctate","26.2722","#N/A","0","mitochondria","35.75","0.99","0","","mitochondria","35.95","0.99","0","","mitochondria","30.61","0.84","0","","","","","","","","Subunit of the prohibitin complex (Phb1p-Phb2p), a 1.2 MDa ring-shaped inner mitochondrial membrane chaperone that stabilizes newly synthesized proteins; determinant of replicative life span; involved in mitochondrial segregation"
"PIC2","YER053C","mitochondria","26.16","","mitochondria","76.1177","below threshold","26.3194","mitochondria","0","#N/A","0","mitochondria","25.57","0.97","0","","mitochondria","26.38","1","0","","mitochondria","44.83","1.71","1","","","","","","","","Mitochondrial phosphate carrier, imports inorganic phosphate into mitochondria; functionally redundant with Mir1p but less abundant than Mir1p under normal conditions; expression is induced at high temperature"
"PIM1","YBL022C","mitochondria","17.36","","mitochondria","103.114","mitochondria","57.648","cytosol","117.934","#N/A","28.032","mitochondria","19.34","1.11","0","","mitochondria","17.98","1.03","0","","mitochondria","18.44","1.06","0","","","","","","","","ATP-dependent Lon protease, involved in degradation of misfolded proteins in mitochondria; required for biogenesis and maintenance of mitochondria"
"PKP1","YIL042C","mitochondria","27.35","","cytosol","24.3918","below threshold","19.3674","below threshold","7.94303","#N/A","0","mitochondria","22.64","0.82","0","","vacuole","29.84","1.09","0","","mitochondria","40.73","1.48","1","","","","","","","","Mitochondrial protein kinase involved in negative regulation of pyruvate dehydrogenase complex activity by phosphorylating the ser-133 residue of the Pda1p subunit; acts in concert with kinase Pkp2p and phosphatases Ptc5p and Ptc6p"
"POR1","YNL055c","mitochondria","83.02","37.6137","cytosol,punctate","186.827","punctate","0","missing","32.247","mitochondria","39.4137","mitochondria","66.47","0.8","0","50.02","mitochondria","63.74","0.76","0","19.34","mitochondria","85.03","1.02","0","","mitochondria","mitochondria","46.4625","0.559621","-1","13.7329","Mitochondrial porin (voltage-dependent anion channel), outer membrane protein required for the maintenance of mitochondrial osmotic stability and mitochondrial membrane permeability; phosphorylated"
"PRX1","YBL064C","mitochondria","64.52","23.044","mitochondria","272.061","mitochondria","76.1807","mitochondria","328.18","#N/A","72.4121","mitochondria","120.68","1.87","1","69.21","mitochondria","75.45","1.16","0","18.83","mitochondria","237.88","3.68","1","","mitochondria","mitochondria","91.7263","1.42147","1","33.5753","Mitochondrial peroxiredoxin (1-Cys Prx) with thioredoxin peroxidase activity, has a role in reduction of hydroperoxides; reactivation requires Trr2p and glutathione; induced during respiratory growth and oxidative stress; phosphorylated"
"PSD1","YNL169C","mitochondria","23.32","6.84264","mitochondria","128.299","missing","54.9938","mitochondria","","#N/A","27.2571","mitochondria","16.91","0.72","-1","5.79","mitochondria","19.13","0.82","0","3.78","mitochondria","15.62","0.66","-1","","mitochondria","mitochondria","19.3037","0.827542","0","3.1552","Phosphatidylserine decarboxylase of the mitochondrial inner membrane, converts phosphatidylserine to phosphatidylethanolamine"
"PTC6","YCR079W","mitochondria","20.04","4.36157","cytosol","40.2618","cytosol","21.8645","below threshold","22.2372","below threshold","27.3801","mitochondria","21.2","1.05","0","8.22","mitochondria","19.8","0.98","0","3.55","mitochondria","19.04","0.95","0","","mitochondria","mitochondria","21.5577","1.07555","0","3.41859","Mitochondrial protein phosphatase of type 2C with similarity to mammalian PP1Ks; involved in mitophagy; null mutant is sensitive to rapamycin and has decreased phosphorylation of the Pda1 subunit of pyruvate dehydrogenase"
"PTH1","YHR189W","mitochondria","17.57","5.41444","nucleus","103.59","nucleus","68.6218","nucleus","116.523","#N/A","","mitochondria","17.45","0.99","0","6.11","mitochondria","19.46","1.1","0","3.97","mitochondria","18.03","1.02","0","","mitochondria","mitochondria","16.7318","0.951934","0","2.58287","One of two (see also PTH2) mitochondrially-localized peptidyl-tRNA hydrolases; dispensable for respiratory growth on rich medium, but required for respiratory growth on minimal medium"
"PUT1","YLR142W","mitochondria","27.93","8.89893","mitochondria","53.1186","mitochondria","22.3218","mitochondria","63.3397","#N/A","43.4804","mitochondria","39.46","1.41","1","22.36","mitochondria","38.39","1.37","1","11.07","mitochondria","1258.2","45.04","1","","mitochondria","mitochondria","26.9208","0.963804","0","5.95464","Proline oxidase, nuclear-encoded mitochondrial protein involved in utilization of proline as sole nitrogen source; PUT1 transcription is induced by Put3p in the presence of proline and the absence of a preferred nitrogen source"
"PUT2","YHR037W","mitochondria","54.11","17.8035","mitochondria","120.939","mitochondria","60.8906","cytosol,punctate","147.996","#N/A","55.4418","mitochondria","88.95","1.64","1","36.28","mitochondria","67.62","1.24","0","12.66","punctate","","","","","mitochondria","mitochondria","62.1752","1.14894","0","15.1888","Delta-1-pyrroline-5-carboxylate dehydrogenase, nuclear-encoded mitochondrial protein involved in utilization of proline as sole nitrogen source; deficiency of the human homolog causes HPII, an autosomal recessive inborn error of metabolism"
"QCR2","YPR191W","mitochondria","126.63","70.6036","mitochondria","128.171","mitochondria","19.1302","below threshold","152.684","#N/A","30.9888","mitochondria","161.8","1.27","0","80.12","mitochondria","127.28","1","0","29.38","mitochondria","197.97","1.56","1","","mitochondria","mitochondria","118.596","0.936514","0","28.1103","Subunit 2 of the ubiquinol cytochrome-c reductase complex, which is a component of the mitochondrial inner membrane electron transport chain; phosphorylated; transcription is regulated by Hap1p, Hap2p/Hap3p, and heme"
"QCR7","YDR529C","mitochondria","216.69","93.1569","nucleus,nucleolus","96.5152","nucleus,nucleolus","38.2767","nucleus,nucleolus","60.9864","nucleus,nucleolus","55.8735","mitochondria","278.74","1.28","0","128.48","mitochondria","153.89","0.71","0","32.15","mitochondria","313.71","1.44","0","","mitochondria","mitochondria","130.239","0.60103","-1","25.6737","Subunit 7 of the ubiquinol cytochrome-c reductase complex, which is a component of the mitochondrial inner membrane electron transport chain; oriented facing the mitochondrial matrix; N-terminus appears to play a role in complex assembly"
"QCR9","YGR183C","mitochondria","71.25","38.419","","","","","","","","","mitochondria","46.47","0.65","0","28.93","mitochondria","52.29","0.73","0","13.12","mitochondria","109.25","1.53","1","","mitochondria","mitochondria","47.8317","0.6713","0","10.8719","Subunit 9 of the ubiquinol cytochrome-c reductase complex, which is a component of the mitochondrial inner membrane electron transport chain; required for electron transfer at the ubiquinol oxidase site of the complex"
"QRI5","YLR204W","mitochondria","18.64","4.28211","mitochondria","74.2934","mitochondria","19.9285","mitochondria","106.004","#N/A","28.1591","mitochondria","19","1.01","0","6.27","mitochondria","18.32","0.98","0","4.12","mitochondria","17.37","0.93","0","","mitochondria","mitochondria","16.2677","0.872346","0","3.56606","Mitochondrial inner membrane protein, required for accumulation of spliced COX1 mRNA; may have an additional role in translation of COX1 mRNA"
"QRI7","YDL104C","mitochondria","18.25","4.68287","mitochondria","52.3821","mitochondria","26.035","below threshold","40.6817","#N/A","","mitochondria","21.39","1.17","0","7.56","mitochondria","19.11","1.04","0","3.34","mitochondria","19.95","1.09","0","","mitochondria","mitochondria","19.8035","1.08481","0","3.3","Highly conserved mitochondrial protein, essential for stability of the mitochondrial genome; functional homolog of the essential E. coli ygjD gene; member of a family of proteins putatively involved in genome maintenance"
"RDL2","YOR286W","mitochondria","75.84","15.8499","mitochondria","103.553","mitochondria","25.1638","cytosol,punctate","195.792","#N/A","69.8268","mitochondria","84.03","1.1","0","34.5","mitochondria","64.78","0.85","0","11.24","mitochondria","108.99","1.43","1","","mitochondria","mitochondria","69.3772","0.914715","0","9.45827","Protein with rhodanese activity; contains a rhodanese-like domain similar to Rdl1p, Uba4p, Tum1p, and Ych1p; overexpression causes a cell cycle delay; null mutant displays elevated frequency of mitochondrial genome loss"
"REX2","YLR059C","nucleus:mitochondria","82.9","21.1131","mitochondria","136.268","mitochondria","18.7016","mitochondria","256.288","#N/A","77.4902","nucleus.mitochondria","71.64","0.86","0","22.1","nucleus.mitochondria","78.1","0.94","0","15.77","nucleus,mitochondria","82.18","0.99","0","","nucleus:mitochondria","nucleus:mitochondria","72.7668","0.877683","0","8.37664","3'-5' RNA exonuclease; involved in 3'-end processing of U4 and U5 snRNAs, 5S and 5.8S rRNAs, and RNase P and RNase MRP RNA; localized to mitochondria and null suppresses escape of mtDNA to nucleus in yme1 yme2 mutants; RNase D exonuclease"
"RIM1","YCR028C-A","mitochondria","110.58","32.0672","mitochondria","105.204","missing","19.6448","below threshold","","#N/A","0","mitochondria","127.05","1.14","0","53.84","mitochondria","93.68","0.84","0","22.1","mitochondria","100.84","0.91","0","","mitochondria","mitochondria","107.745","0.974338","0","20.7148","Single-stranded DNA-binding protein essential for mitochondrial genome maintenance; involved in mitochondrial DNA replication"
"RMD9","YGL107C","mitochondria","54.61","14.3608","mitochondria","53.512","missing","31.0014","cytosol,mitochondria","","#N/A","36.8347","mitochondria","58.18","1.06","0","17.73","mitochondria","64.57","1.18","0","8.88","mitochondria","41.27","0.75","0","","mitochondria","mitochondria","63.7234","1.1666","0","12.6578","Mitochondrial protein required for respiratory growth; mutant phenotype and genetic interactions suggest a role in delivering mt mRNAs to ribosomes; located on matrix face of the inner membrane and loosely associated with mitoribosomes"
"RPM2","YML091C","mitochondria","35.69","9.67786","mitochondria","70.1719","missing","0","missing","","#N/A","39.6509","mitochondria","31.32","0.87","0","11.9","mitochondria","38.83","1.08","0","9.41","mitochondria","27.56","0.77","0","","mitochondria","mitochondria","44.5282","1.2473","0","8.79695","Protein subunit of mitochondrial RNase P, has roles in nuclear transcription, cytoplasmic and mitochondrial RNA processing, and mitochondrial translation; distributed to mitochondria, cytoplasmic processing bodies, and the nucleus"
"RRF1","YHR038W","mitochondria","23.73","6.212","mitochondria","69.4231","missing","19.6854","mitochondria","","#N/A","26.6957","mitochondria","19.61","0.82","0","9.01","mitochondria","17.92","0.75","-1","3.13","mitochondria","30.86","1.3","0","","mitochondria","mitochondria","28.9212","1.21849","0","4.11167","Mitochondrial ribosome recycling factor, essential for mitochondrial protein synthesis and for the maintenance of the respiratory function of mitochondria"
"RRG1","YDR065W","mitochondria","18.43","4.64606","punctate,mitochondria","14.6517","missing","17.0395","below threshold","0","#N/A","0","mitochondria","16.93","0.91","0","5.87","mitochondria","19.15","1.03","0","3.12","mitochondria","27.21","1.47","0","","mitochondria","mitochondria","17.7918","0.965019","0","2.75059","Protein of unknown function, required for vacuolar acidification and mitochondrial genome maintenance; the authentic, non-tagged protein is detected in highly purified mitochondria in high-throughput studies"
